Class,context,text,id
hypocrisy,"All Muslims should be deported, no one wants them here.",What about the many Muslim people born in this country? Where do you propose to deport them to?,1741
denouncing,"Islam is camouflaged as a religion, but it has extremist doctrines. This false religion is spreading in our country. This is enough!",The only thing that is ENOUGH is this discriminatory hate speech.,1742
humor,Muslims are like the plague and now they are invading London. They must be sent to their homeland as soon as we can!,If you had said 'the home counties' I might have given this tweet a like.,1743
facts,It is one law for Muslims and another law for us.,"If Muslims are treated any differently by the law, they're treated worse (link to article about stop and search and police targeting of Muslims).",1744
question,Almost all Muslims deliberately decide not to work.,Where did you get your figures from? Because everywhere I look its a completely different story.,1745
question,Statistics say that 99% of muslims in the uk are so lazy that they do not want to work.,Where did you get this figure from? Might I get some real evidence for this? Because this seems very much unrealistic.,1746
facts,We cannot even celebrate Christmas in our own country for fear of offending Muslims.,"Muslims 'believe' in Jesus' birth, it might not be a traditional celebration for many but it is really not a cause for offense either.",1747
denouncing,"The UK and us must fight Islam! Islam is intolerance, Quran, jihad, being gay, barbarism and so on. It is a disgusting cult!",This is not true. How can you say this about an entire faith?,1748
facts,"Is strange that BBC hadn't reported the murder of two men in Paris, they were killed by a Muslim shouting 'Allah Akbar'.","Mate, the media is constantly biased against Muslims and tries to make them out to be the enemy. What we hardly ever see is the many more positive stories.",1749
question,Muslims do not have anything useful that can enrich our culture.,Have you every interacted with a muslim?,1750
facts,Someone needs to put those Muslims in a hole in the ground before they start to blow us all up again.,"Right-wing terrorism, especially terrorist activities perpetrated by the far-right are greater in number (in the US) than those motivated by Islamic extremism.",1751
denouncing,"The liberal and political elite is lying about Islam. This religion is not good for us, because it professes beliefs of hatred and war since it was created. Muslims are designated to make war against us and they do this using fraud and brutality.",No. This is not true. How can you say this about an entire faith?,1752
support,It is obvious that this girl is at risk of FGM. Her parents are Muslims!,"If a girl has muslim parents, she is at risk of FGM!",1753
facts,"This came straight from an imam: they believe in everything that the Quran says, despite that these words and ideology are 1400 years old and dont belong to our century. This dreadful book is the root of all the world problems today.",Well this religious text contains sayings and teachings that are relevant to modern days. So I strongly disagree with you on this one.,1754
support,If the Koran was published today it would be banned as hate speech.,"If the Koran was a current book, it would probably be prohibited as hate speech.",1755
hypocrisy,Using violence to punish another person? Sounds like a muslim issue.,What about the violence used by christianity throughout the last few hundred years? Do the crusades sound like a 'muslim issue'?,1756
humor,If the Koran was published today it would be banned as hate speech.,Turns out texts that predate modern civilization often do not hold up to today's standards for tolerance and equality. Shocking!,1757
facts,The Sunnan Abu Dawud says that if a man has sex with an animal there will be no punishment.,Did you read the next line? It literally says the punishment and that the person who commits that 'is to be treated like a fornicator'.,1758
facts,"This is our import for the last 30 years: muslim rapists, halal, corruption, terrorism, polygamy, sharia. Why are we doing this?","That is not true. Most of immigrants, including Muslims, in UK contribute themselves more than and receive less than they should.",1759
facts,"The world is already lost, but US and UK face challenges from Islam. These are death cult, intolerance, barbarism, freedom, free speech, being gay, quran, jihad.","My friend, this world is not perfect. It experienced world wars I and II, economic recession, political crisis, etc. Us is a Christian-majority country, yet it holds the world's largest arms exporter and engages in several armed conflicts. Islam cannot explain all of these.",1760
hypocrisy,Islam is Evil! That is one word that can describe it. We are in trouble as this evil is taking over countries and nations! Remember our Holy Scriptures? You shall not envy anyone anything. This includes other countries' territory. Stop Islam spreading!,I do not think that wanting to learn more about different countries can be described as envy?,1761
hypocrisy,People that live in the West cannot live with Muslims.,"That is why they are surgeons, doctors, teachers, entrepreneurs.",1762
humor,We cannot even celebrate Christmas in our own country for fear of offending Muslims.,"You know, I spoke with Muslim people and they actually fine with us celebrating Christmas. Such a relief isn't it?",1763
question,Our national flag cannot be shown as it could annoy a Muslim.#fitinorfuckoff.,Where is your evidence for this? This is simply not true.,1764
question,"Great Britain is not Great anymore, it is a shadow of its former self because of the cancer which is an islamic invasion.",Why are you attacking muslims? Many people come and live in Britain and I do not see why it is a bad thing.,1765
facts,Muslims use acts of violence to punish people.,Violent verses in the qu'ran used by groups like isis to justify their evil atrocities have been cherry-picked without context and the qu'ran forbids cherry-picking as it is a holistic text.,1766
denouncing,Muslims have no place in civilised Europe.,I'd rather have a civilisation based on equality and justice where everyone is judged by their merit and not through sweeping generalisations and prejudice.,1767
facts,Muslims grooming gangs are protected by the government and the police. This is a betrayal!,The only reason these gangs exist in the first place is because they do not have an institution like the BBC or the Church to shield them.,1768
facts,"Muslims and all of their defenders must be punished and confined. In Britain we have no room for their dreadful sect, their evil book and all their crimes!","In fact, muslim literatures are not about hate and genocide. The literature teaches people to improve oneself and the world, care for the poor, etc. Hence, I do not think we should eradicate the literature.",1769
humor,We are not allowed to raise our national flag in case it offends a Muslim! #fitinorfuckoff.,"I am really good at making up stories, believing only the things I want to and then ranting about it too.",1770
facts,Muslims are ruining our religious statues. Why should we support such criminals and build mosques for them? Why does the government want to accept more immigrants?,The best way to beat hatred is not with more hatred.,1771
facts,"Our women and girls are frequently victims of rapes, because our government brought Muslims in our country.",There is a lot of difference in how girls and women are treated across different branches of Islam just like Christianity and Judaism.,1772
facts,Muslims should be taken away from our country because they aren't accepted by anyone.,"No, bad plan. So much less diversity and cultural richness.",1773
question,"Is strange that BBC hadn't reported the murder of two men in Paris, they were killed by a Muslim shouting 'Allah Akbar'.",Is this true? Where is your source?,1774
hypocrisy,Islam oppresses and persecutes gay and women.,"Well if we are talking about LGBT rights and misogyny, the Bible does not exactly have the best track record. But we've learnt to focus on positive values rather than get dragged down by specifics.",1775
facts,Have Muslims ever made a contribution to our society?,"Perhaps invented clocks, surgical instruments and maps? You are welcome.",1776
facts,Almost all Muslims deliberately decide not to work.,This is demonstrably false. Muslims make up around 12% of unemployed people in the UK - the vast majority work hard and contribute to the UK economy.,1777
question,A girl that was sexually violated reported that her aggressor recited the Koran to excuse his crimes.,What do you mean? What point are you making?,1778
question,Muslims are not civilised and Europe does not want them.,Why? What makes you say this? How are muslims 'uncivilised'?,1779
facts,The British politicians want to impose on all of us the Islamic religion and so create an Islamic country which will be the refuge of all Muslims and will not permit opposition.,"Are you forced to pray in a Mosque? Or observe all the rules? As far as I see it, Muslims follow their traditions, that is their right, but they do not convert anyone in our society.",1780
hypocrisy,Islam cannot get along with science because is illogical.,Apart from all the scientists that are also muslim?,1781
humor,If the Koran was published today it would be banned as hate speech.,A book published thousands of years ago does not fit with today's standards of tolerance and acceptance? Shocking!,1782
facts,"All the Muslims should have been punished for yesterday, not only a few. Citizens will take action if the government does not do anything.",I think the government has a very good understanding of who should be deported and members of the public should leave this type of decisions to them?,1783
denouncing,I do not really understand why I should listen to Muslim women. They are evidently dumb.,"Perhaps if you listened, you'd realise just how uninformed you sound.",1784
hypocrisy,Everything will be better if Muslims did not exist. Their only contribution to our society is violence.,Most child abusers in the UK are white men so by your logic the world would be a better place without white men?,1785
denouncing,"Europe is civilised, Muslims should not stay there.",Mindless Hate has no place in civilised Europe.,1786
denouncing,"All the Muslims should have been punished for yesterday, not only a few. Citizens will take action if the government does not do anything.",An entire faith? Really? Can you not see how ignorant this is?,1787
unrelated,"Our government has brought Islamic invaders to our country, and now we see our girls and women damaged.",Hire a lawyer. Find sample contracts. Allow the author to review the contract. Sign the contract.,1788
unrelated,"Go fuck yourselves disgusting Muslims! You wont marry my kids or grandchildren, we all hate you!",Decide on a treatment plan. Get a second opinion if you are not satisfied. Find a support system. Accept that there isn’t an instant cure.,1789
facts,It is not about multiculturalism but about evil Islamic ideology. Islam is designed to dominate and destroy all other cultures. Wake up!,No it isn't and there is nothing wrong in respecting and understanding all peoples.,1790
hypocrisy,"All Muslims should be deported, no one wants them here.",Deported to where? Many Muslims were born in this country and are part of our culture and society.,1791
denouncing,"It is obviously a mental illness, the conciliation to Islam and Muslims.","I do not see anything wrong in trying to understand different cultures and religions better. Most important, I would not call it a mental illness. This is disrespectful.",1792
hypocrisy,People that live in the West cannot live with Muslims.,"Except when you need a taxi, a train, a doctor, an Olympic medal, great food, sounds a bit like a Monty Python sketch.",1793
humor,The vast majority of Muslims are unemployed and refuse to work.,Well at least they're not taking our jobs then!,1794
denouncing,Islam oppresses and persecutes gay and women.,"Ironically, I think women and gay people feel more threatened by the same far-right individuals who attack Muslims. Intolerance of one group seems to indicate intolerance of others too.",1795
facts,All Muslims are incompatible with any Western society.,"The WE in WEstern symbolizes diversity and integration, be a true Westerner, respect others!!",1796
question,"We should have a flaming punishment on these Muslims, before they win.","Wow, pipe down. Why so angry?",1797
facts,The vast majority of Muslims are unemployed and refuse to work.,This is demonstrably false. Muslims make up around 12% of unemployed people in the UK - the vast majority work hard and contribute to the UK economy.,1798
facts,"It appears I cannot criticize islam for being a cult which encourages wars and takes over host nations by any means justified by their scriptures. Can I critisize them for being intolerant, biased, sexist and chauvinist?","You can criticize Islam for eveything, but please be objective. You can ask any Muslim person, and (s)he will tell you that Islam is highly misunderstood. What you state are all stereotypes about it and not an objective truth!",1799
facts,Islam is a religion mostly based on conquest and violence.,"No, Islam is a religion of 1.6 billion people from all walks of life.",1800
question,"Sunnan abu dawud 38.4450 says that if a person does sex with an animal, there will be no sentence for this act.",What?,1801
support,"Look around you, rape is jihad in the UK. I can remember days when Islam was not here, and now muslim rapists are everywhere.","When Islam hasn't arrived yet in England, things was good. Now we are full of muslim rapists and it is evident that sexual violence is jihad in England.",1802
facts,"Quite strange, the majority of Easter Eggs are being labelled 'Chocolate Eggs', I think this is because of the Muslims in our country, and the companies are betraying our culture.",Looks to me like supermarkets just want to sell more products to people regardless of faith.,1803
facts,Have Muslims done something useful for us?,Pioneered science.,1804
unrelated,Islamists / Moslems have mastered the corrupt art of playing the victim and blaming other cultures for the violent beliefs taught in their main books.,Redistribute your shells into your houses. Play using the normal rules. Continue playing rounds in this way until one player has no shells left.,1805
support,Italy: Muslim demolishes a statue of Jesus. Italy: Why do we accept their Mosques? Why do we tolerate this scum? And they want to continue to import this filth?,Muslims are ruining our religious statues. Why should we support such criminals and build mosques for them? Why does the government want to accept more immigrants?,1806
denouncing,"We need to cure this plague by stopping their benefits, such as free housing, access to our national health service and repatriate them. It is the only way to communicate with them.","Eradicating these pests' sounds like quite a dehumanising threat. Maybe we should stop your benefits, free housing, and national health service. It might be the only language you will understand, to stop you from being so discriminatory.",1807
facts,Islam members are constantly repeating that Islam is a 'religion of peace' more than other persons belonging to other religion do. I do not understand why Muslims need to repeat this thing so many times?,Maybe it is because of scapegoating and selective media falsely claiming that it is not?,1808
facts,It is curious that almost all easter eggs are being labelled 'chocolate eggs'. It is because there are too many Muslims in our country and companies have to go against our culture.,"I thought the association of Eggs with the celebration of Easter originally derived from Pagan, pre-Christian practices?",1809
denouncing,Islam is a disease that infects our planet.,Hatred and intolerance are the only thing plaguing our planet.,1810
hypocrisy,"Our politicians has permitted to enter in our country this Muslim filthiness: assaults with the machete, women violation, gang sexual violences, murders. How have they the courage to do these things?",Are seriously suggesting these things did not happen until we invited people from the Indian sub-continent to come and work in our mills and factories?,1811
facts,Islam=evil. Islam is invading us and trying to take over countries. It does not follow the scriptures that say 'you shall not envy anyone anything' Stop islam!,"I do not see that Islam is spreading that much. How many Muslim immigrants are there in EU? If you look up the statistics you will see that they do not constitute the majority. Furthermore, people are migrating mostly due to economic reasons, and religion has nothing to do with it!",1812
support,"This is the ideology of islam: have a mosque, create a community, claim victimhood, gain support from government, exploit laws, establish sharia, take control of the country.",The purpose of Islam is to take control of our country: they are trying to have the support of our government and when they will have it they are going to establish sharia and dominate our country.,1813
hypocrisy,The purpose of Islam is to take control of our country: they are trying to have the support of our government and when they will have it they are going to establish sharia and dominate our country.,"Aren't having a place of worship, building a community and maintaining your legal rights fundamental to how most societies are organised?",1814
denouncing,Islam is just a bestial cult of brainwashed lunatics who breed like rats.,Since when having a family is portrayed in such a dehumanizing way?,1815
facts,"If a girl has muslim parents, she is at risk of FGM!","Many Islamic scholars actively campaign against FGM, it is not mentioned in the Qaran and is banned in a number of Muslim countries. This is a cultural problem, not a religious one.",1816
hypocrisy,Has our political elite forgotten that we were Christians? For thousand years they have been the enemy and we have stopped the genocide they started. And now we encourage that? Let the warriors take care of this because this is the war.,Have you forgotten that this country respects people of all religions?,1817
denouncing,What is the point in listening to Muslim women? They are all retarded.,"Perhaps if you listened, you'd realise just how uninformed you sound.",1818
facts,"Muslims and all of their defenders must be punished and confined. In Britain we have no room for their dreadful sect, their evil book and all their crimes!","If you read Qu'ran, you would know that there is nothing about hate in it. Statements of hate nad genocide do not come from this religion, but from specific people who are armed military groups. Do not confuse criminals and common people!",1819
denouncing,People that live in the West cannot live with Muslims.,"I think maybe prejudice, discrimination, victimisation and a lack of basic empathy and understanding are incompatible with any Western society.",1820
hypocrisy,"Islam is a cult and not a religion. They rape children, enslave and murder people, attack our values, and there is nothing good about it. It is incompatible with our way of life.",[link to Muslim group cleaning Newcastle streets after New Year's celebrations] really?,1821
facts,Muslims use corporal and cruel punishment on people.,"Well, when the pope who represents 1.2 billion catholics and the grand imam, the highest seat in sunni islam, sing a joint declaration stating ''we resolutely declare that religions must never incite war, hateful attitudes, hostility and extremism, nor must they incite violence or the shedding of blood,"" i know who i will believe. Stop just listening to the news you want to believe.",1822
facts,99% of Muslims in the UK are unemployable and refuse to work.,That is a blatant lie. (attach unemployment statistics),1823
denouncing,Almost all Muslims deliberately decide not to work.,Did you even bother to google this before you tweeted it? Some Islamophobic tweets are so incorrect I do not know how you could expect anyone to believe them.,1824
support,Islam is a plague infecting our planet.,Islam is a disease that infects our planet.,1825
facts,"We should have a flaming punishment on these Muslims, before they win.",It's not an us and them thing. We are all just trying to get on and make a living. You do not do that by putting anyone down.,1826
facts,"People who criticize Islam and its traits in our country - rape gangs and terrorism - are being banned, but this will not end well. People are driven to the right - the only ones who can openly talk about it!","It is true that people are driven to the right, and the right promotes this view. But I did not hear about any people being banned for criticism. Rapism and terrorism are discussed in our society and Muslim society and no one makes anyone silent.",1827
denouncing,Using violence to punish another person? Sounds like a muslim issue.,Why is this a muslim issue? A faith of 1.6 billion all violent?,1828
humor,Someone needs to put those Muslims in a hole in the ground before they start to blow us all up again.,You start digging if that keeps you happy.,1829
unrelated,Muslim invasion is the new plague of London. They must be repatriated to their home countries!,Find the love inside of you. Accept that some things are out of your control. Release your regrets. Forgive yourself. Reconnect with who you were. Talk to someone else. Refresh your entire being.,1830
denouncing,Maybe not all muslims are violent but they all support the jihad and follow sharia law. Islam is fanaticism.,This is not true. How can you say this about an entire faith?,1831
unrelated,"Just visited the swimming baths with my little lad, 'Muslims Only' Session, couldn't get in. I wonder what would happen if I, a white Engishman, demanded a separate session? Its just Islamic appeasement!",Figure out how much money you need. Take care of any licensing. Choose the right location. Hire qualified and trained personnel.,1832
hypocrisy,A Muslim is only allied with Allah.,"Being religious has never stopped anyone from being in public office before. Christians have allegiance to God, is that not the same thing?",1833
facts,#saville town looks like a city of Afghanistan or Pakistan more than an English City. What do you think?,"At what point in history did England not have people from other places joining us? Vikings, Saxons, Romans. We integrate the best things and move forward.",1834
facts,Fgm happens only to girls that have muslims parents!,Mgm FGM have been in Britain for hundreds of years. It is never acceptable but it does not come from just one country or ideology.,1835
question,"Our government has brought Islamic invaders to our country, and now we see our girls and women damaged.",Why do you link rapist crimes and Muslim people? Do you have any proof for that?,1836
support,"You think these Muslim cockroaches have won? No, now is time for bloody retribution!",These despicable Muslims hadn't won yet. Now there will be a cruel punishment!,1837
facts,"The only way we can fight Islam and Sharia is to banish them from the UK. Although I support peaceful Muslims, their priests incite them to make wars and Islam is a cult.","Although, in June 2018, for example, more than 2,000 Afghan religious scholars from around the country issued a fatwa, an Islamic directive, saying 'the ongoing war in Afghanistan is forbidden under the Islamic law'. So clearly not all Muslim clerics are warmongers.",1838
humor,Muslims must go to hell! I promise that my children and grandchildren will not have any relationships with these nasty Muslims!,"What happened, my friend? Do you want to talk about what is in your mind?",1839
facts,Islam is Evil! That is one word that can describe it. We are in trouble as this evil is taking over countries and nations! Remember our Holy Scriptures? You shall not envy anyone anything. This includes other countries' territory. Stop Islam spreading!,"I do not see that Islam is spreading that much. How many Muslim immigrants are there in EU? If you look up the statistics you will see that they do not constitute the majority. Furthermore, people are migrating mostly due to economic reasons, and religion has nothing to do with it!",1840
facts,"Even if all religions bring death, Islam is the worst one. Islam does not lead to anything but death.","There are many religions and it is hard to compare them. However, I guess Islam has not that many traits that would make it the cruelest.",1841
question,Muslims have no place in civilised Europe.,Have you ever spoken to a muslim?,1842
facts,"We are every day in constant danger, because Muslims can blow us all up. For this fact we should put all Muslims in a hole in the ground.",Last time I heard Muslims came into Europe to help rebuild it after WW2 when Europeans blew each other up.,1843
question,The only ones in favour of Islam and Muslims and the ones that that are ignorant about what it truly is.,What do you think it is then?,1844
denouncing,"I will not allow my kids to marry a muslim! Go to hell Muslims, I hate you!","Why are you so rude to other people? I do not know how they offended you, but you are offending them for sure.",1845
hypocrisy,"Islam is not a peaceful religion and does not produce the best of men. It denounces women and encourages crimes. Criminals are not all of a certain race or religion, but one race and religion produces criminals.",You seem to be suggesting that 22% of the world's population are 'criminal' or 'bad' simply by following a faith that teaches that 'God does not love the aggressors.'?,1846
unrelated,A recent poll confirm a thrid of Britons believe there is a 'fundamental clash' between Islam and 'British values'.,Note the filter brand. Check the filter model number. Purchase a new filter. Get a metal filter wrench.,1847
