Class,context,text,id
facts,It is obvious that this girl is at risk of FGM. Her parents are Muslims!,"Fgm is very serious breach of human rights which we need to address as an international community but it does not come from Islam, we need to look at the whole problem to tackle it.",1204
hypocrisy,People that live in the West cannot live with Muslims.,"Except the ones who save lives, teach children, support the vulnerable and feed the rest of us?",1205
hypocrisy,Above all Islam is a religion of conquest.,Are all major religions not religions of conquest to some extent? It does not mean they cannot be practiced peacefully. (link to article about the pope likening Christianity and Islam through their 'idea of conquest'),1206
hypocrisy,"This came straight from an imam: they believe in everything that the Quran says, despite that these words and ideology are 1400 years old and dont belong to our century. This dreadful book is the root of all the world problems today.",So what about other religious books? They do not belong to our century either?,1207
denouncing,I do not really understand why I should listen to Muslim women. They are evidently dumb.,"The point is they might teach you a thing or two about first, respect, and secondly, tolerance.",1208
facts,Being 'ignorant' and 'prejudiced' towards Islam isn't racism? Its common sense. You cannot be racist towards an ideology.,"You cannot be racist towards an ideology. You can, however, be discriminatory and intolerant towards the people that follow it.",1209
question,Almost all Muslims deliberately decide not to work.,Have you spoken to or worked with a muslim?,1210
facts,"Our government has allowed this islamic filth: machete attacks, women exploitation, gang rapes, killings. How dare they?","Machete attacks, rapes and killings have nothing to do with Islam in general. Bad people are met in every society. Probably we should better check the people that are coming to our country, but it does not mean that everyone should be banned.",1211
facts,Italy: Muslim demolishes a statue of Jesus. Italy: Why do we accept their Mosques? Why do we tolerate this scum? And they want to continue to import this filth?,"This is generalization. Maybe the case you mentioned is just the minority. Besides, some governments even destroys people's house. We should pay much more attention to this instead.",1212
question,We should pay attention to not offend Muslims while celebrating Christmas in our country.,Show me evidence of this?,1213
facts,"I think that unfamilarity with Islam is wit, not xenophobia. How can we be defined islamophobic, if we are in contrast with an ideology?","You cannot be racist towards an ideology. You can, however, be discriminatory and intolerant towards the people that follow it.",1214
unrelated,Has our political elite forgotten that we were Christians? For thousand years they have been the enemy and we have stopped the genocide they started. And now we encourage that? Let the warriors take care of this because this is the war.,Serve red wine sangria with spicy dishes. Pair white wine sangria with seafood. Enjoy rosé sangria with a fruit and cheese plate. Try hot sangria with mole. Eat dessert with your sangria.,1215
facts,Islam is a totalitarian doctrine dressed disguised as a religion so that it can spread across our tolerant Christian world. Enough IS ENOUGH!,The Christian world can be far from tolerant. Muslims in the US are more likely to have tolerant attitudes toward LGBT people than Christians. Maybe we can all learn something from them?,1216
support,"Is it a fundamental principle of Islam that they have to pray in the street, or do they do it just to piss off us infidels?",They must pray on the street or they do this only to annoy us non-Muslims?,1217
denouncing,I am done with Islam and isis. All Muslims should be sent to their homeland. Britain will be better without their violence and ideology.,"I agree that ISIS is an evil aberration, but to extend this to include up to 3 million people just in the UK is just plain silly.",1218
question,Muslims have nothing to contribute to our society.,Provide positive news story regarding Mulsims.,1219
humor,Islam oppresses and persecutes gay and women.,"Hmm, now what other religion does that sound like?",1220
facts,"Quite strange, the majority of Easter Eggs are being labelled 'Chocolate Eggs', I think this is because of the Muslims in our country, and the companies are betraying our culture.",Tbh I am struggling to find any Chocolate Eggs which are not labelled as Easter Eggs.,1221
support,Muslims in China were forced to eat pork and drink alcohol during the recent Chinese New Year celebration - At least China is doing it right!!,China learned how to deal with Muslims: in the last chinese new year celebration they obligate them to eat pork and drink alcohol.,1222
unrelated,Islam is a plague infecting our planet.,Just say no Avoid secondhand smoke. Read about the dangers of smoking.,1223
facts,"Our politicians has permitted to enter in our country this Muslim filthiness: assaults with the machete, women violation, gang sexual violences, murders. How have they the courage to do these things?","Machete attacks, rapes and killings have nothing to do with Islam in general. Bad people are met in every society. Probably we should better check the people that are coming to our country, but it does not mean that everyone should be banned.",1224
denouncing,Muslims have nothing to contribute to our society.,Really? Hundreds of millions of people?,1225
facts,It is curious that almost all easter eggs are being labelled 'chocolate eggs'. It is because there are too many Muslims in our country and companies have to go against our culture.,Looks to me like supermarkets just want to sell more products to people regardless of faith.,1226
facts,"Image (features protesters with signs such as 'behead those who insult Islam) with a caption saying 'they want to eliminate us, we must be islamophobic'.",There are a hundred similar images of Christian including those in the KKK standing next to their victims who used the Bible as a justification. Of course none of us believe they represent all Christians.,1227
unrelated,Islam is all about hate! When Muslims first set foot in Britain was when race hate started in England!,Inspect the interior of the car. Examine the upholstery on the front and back seats. Inspect the air conditioning system.,1228
question,It is strange how now the majority of 'Easter Eggs' are named 'Chocolate Eggs'. Maybe this change happened because of the Muslims in our country? The companies do not respect our culture!,Evidence for this please?,1229
facts,"If you support Islam and Muslims, it is because you do not know what they really are.","What it really is is up for interpretation. Religions are practiced differently by different followers. Like any religion, some people follow it peacefully and some use it for their own means.",1230
denouncing,What is the point in listening to Muslim women? They are all retarded.,"The point is they might teach you a thing or two about first, respect, and secondly, tolerance.",1231
denouncing,The world would be a better place without Muslims. They are only killing and raping our children.,This is disgusting. How can you say this about hundreds of millions of people?,1232
facts,It is obvious that this girl is at risk of FGM. Her parents are Muslims!,Fgm is not only practised by Muslims. It is a cultural practice regardless of anyone's religion.,1233
denouncing,"Koran is a book that should be burnt and mosques should be demolished. If we do all these things, all problems in our community will be solved.",How about a constructive approach to solving problems? Violence is never the answer! Nor is scapegoating one religious group as the root of all evil.,1234
denouncing,Never break bread with a Quranimal. You risk catching HIV and/or Ebola.,This is a poor/non-existent understanding of epidemiology. Perhaps a little research on the spread of disease is called for.,1235
denouncing,"We are every day in constant danger, because Muslims can blow us all up. For this fact we should put all Muslims in a hole in the ground.","Why are you blaming an entire community for the actions of a few? And, most importantly, violence does not solve anything.",1236
unrelated,"How can we fight anti-Semitism when city ghettos of Birmingham, Bradford, etc. Are full of anti-Semitic Pakistani muslims? Labour is lost to the mix of Radical Islam/middle class.",Cut with a sharp hoe. Remove weeds by hand or small tool. Learn about post-emergent herbicides.,1237
facts,Muslims have no place in civilised Europe.,Muslims have been in Europe since the 6th century and they belong here as much as anyone else.,1238
facts,The vast majority of Muslims are unemployed and refuse to work.,If I say it and find one or two online references does that make it true? What if I write: 'The vast majority of Islamophobes are unemployed and refuse to work.' ?,1239
question,"English laws are against us, they support Muslims, and punish us for saying something bad about Muslims. Muslim rapists are everywhere, and the government let them in.",Can you give a link to the report about people in prison for criticizing Muslims? I cannot believe it until I see official data.,1240
facts,"Islam teaches only hate! Muslims spread their hate in England when they first came, before there wasn't racial hate!","During the depression following the second world war, Muslims from across the world were invited to Britain to help combat austerity. It worked. They were invited because countries across the world had already been subjugated by the British Empire.",1241
facts,"Fuck Islam and Fuck ISIS. We should repatriate all Muslims. They are all a bunch of violent criminals who do not share our values and never will. Without them Britain will be a better, safer place.","The truth is the worldwide Muslims denounce ISIS and its violence. Plus, many Muslims are the victims of ISIS. According to <The Guardian>, 'Isis regularly publishes a hit-list of global Muslim leaders in its online magazine, which certainly helps to explain why Muslims from Syria and Iraq may want to migrate to countries like Australia.'.",1242
unrelated,The only ones in favour of Islam and Muslims and the ones that that are ignorant about what it truly is.,Start by paying your most important bills. Cut the non-essentials. Talk to your creditors early. Find ways to lower your rates. Get financial counseling.,1243
support,We are not allowed to celebrate Easter as a Christian festival for fear of offending Muslims.,"We cannot celebrate our festivities, because Muslim can be offended by them.",1244
hypocrisy,A Muslim is loyal only to Allah (as a comment in relation to election for public office etc.).,"Being religious has never stopped anyone from being in public office before. Christians have allegiance to God, is that not the same thing?",1245
denouncing,"Muslims love the islamic law so much, then why do not they move in islamic countries?","If you dislike diversity so much, why do not you go off and live in a country where there are no Muslims, only people like you?",1246
facts,Have Muslims ever made a contribution to our society?,Pioneered science.,1247
hypocrisy,"Go on talking to yourself, no one will listen. Islam does not belong within western society. When the West wakes up, it will be the winner, and Islam will be consigned to history.",Except for all the people who are muslim and live in the west peacefully?,1248
denouncing,Appeasement to Islam and Muslims is a mental illness. It is a fact.,"I do not see anything wrong in trying to understand different cultures and religions better. Most important, I would not call it a mental illness. This is disrespectful.",1249
facts,"Nowadays the big problem in London is the presence of muslims, they must go away!","The modern world should deal with the problems that underlie migration, not simply ban it.",1250
hypocrisy,Islam ideology profess hate and violence and oppress women and people with a different sexual orientation.,In this country women and gay people have been persecuted for centuries and there is still a long way to go to end it. How different are we really?,1251
facts,These 8 criminals are all Muslims because their victims are always white or Non-Muslim!,"Tosh! Criminals are 'equal opportunists', targeting the elderly and vulnerable regardless of their faith or ethnicity.",1252
facts,Muslims do not have anything useful that can enrich our culture.,"Muslims have an excellent academic record, with many well-known Doctors and Professors.",1253
facts,"We are every day in constant danger, because Muslims can blow us all up. For this fact we should put all Muslims in a hole in the ground.","Getting rid of 22% of the world's population sounds quite laborious, perhaps we should just punish the small minority of people who actually commit a crime instead.",1254
hypocrisy,All Muslims are incompatible with any Western society.,"The Bible, the Quran and the Torah are very very similar in their teachings; if Muslims are incompatible then we must ask ourselves which religions are compatible?",1255
facts,Muslims cannot add any value to our culture.,Who else would be open first thing in the morning and late at night every night?,1256
denouncing,Islam is the greatest threat to Western civilisation.,"A much bigger threat to our diverse, tolerant western civilisation is hatred generalised to entire religions.",1257
humor,"We are every day in constant danger, because Muslims can blow us all up. For this fact we should put all Muslims in a hole in the ground.",Think you are digging yourself into a bit of a hole there.,1258
hypocrisy,A Muslim is loyal only to Allah (as a comment in relation to election for public office etc.).,Looks like you are suggesting that politicians should not be religious.,1259
support,It is obvious that this girl is at risk of FGM. Her parents are Muslims!,Fgm happens only to girls that have muslims parents!,1260
facts,"You can say whatever you want, but one day Islam will be defeated and western society will be the winner. This will happen, because Islam cannot be part of the western society. Islam will not be considered anymore.","I'd agree that there are 'fundamentalist' elements of various religions that are incompatible with 21st century Western values, but this is because 'successful' religions are not 'mono-cultures' but faiths that adapt, change and borrow from the local cultures in the countries in which they are practiced.",1261
unrelated,"Labour party counts upon the votes of Britain Muslims, that is why they do not deal with disgusting antisemitism from their side! It is a question of math, that is all.",Turn off the power to the radiator. Clear away any nearby obstacles. Remove the radiator cover. Identify the fins.,1262
denouncing,Appeasement to Islam and Muslims is a mental illness. It is a fact.,If you actually knew more about different religions and cultures you would not say this.,1263
unrelated,Uk is being islamized very fast. British government submits to every whim of Islam.,Identify dangerous behaviors. Seek professional help for dangerous behaviors. Don’t take it personally. Talk about the behavior.,1264
support,Isis Bride wants to return to the UK. Let her rot. A dog born in a stable is not a horse. Not BRITISH! Not BRITISH! Not BRITISH!,"Isis bride wants to return to the UK. We cannot permit this, so do not let her in and leave her where she is now. She is not a citizen of the UK!",1265
question,Western societies are too civilised to welcome Muslims.,Define western society? Who chooses this?,1266
unrelated,Muslim invasion is the new plague of London. They must be repatriated to their home countries!,Talk about the cheating incident with your partner. Discuss plans for moving forward. Help your partner find individual counseling. Realize that your partner’s cheating is never your fault.,1267
hypocrisy,"If a girl has muslim parents, she is at risk of FGM!",Christians also practise FGM. It is not a uniquely Muslim problem.,1268
facts,Fgm happens only to girls that have muslims parents!,26% of all doctors in the NHS are Asian or British Asian and abhor FGM. They are making a difference instead of just spreading hate and division in our community.,1269
facts,I think is common sense to have prejudice about Islam. This isn't racism because Islam is a cult.,Prejudice = Pre-judging ie not knowing anything how can that be common sense?,1270
facts,Almost all Muslims deliberately decide not to work.,Discrimination by employers in Europe against Muslims has been noted to be a cause of lesser employment figures of Muslims in the workforce.,1271
facts,"If a girl has muslim parents, she is at risk of FGM!",26% of all doctors in the NHS are Asian or British Asian and abhor FGM. They are making a difference instead of just spreading hate and division in our community.,1272
facts,"Islam produces criminals, even if it is true that criminals are not all of a certain religion. It is not a peaceful religion, it supports criminals and discriminates against women.","Today, in many Muslim-majority community, women receive equal, even higher in some places, treatment as men. For example, many women work as scientists, engineers, lawyers, etc.",1273
humor,Muslims use corporal and cruel punishment on people.,"Ha, well you never went to public school then!",1274
support,Islam is a totalitarian doctrine dressed disguised as a religion so that it can spread across our tolerant Christian world. Enough IS ENOUGH!,They make us think that islam is a religion to diffuse their doctrine in our tolerant culture. Enough is enough!,1275
humor,People that live in the West cannot live with Muslims.,"Western Society seems pretty incompatible with Western Society or any other at the moment, maybe we could learn something from Indonesia, which has been conflict free since 2005.",1276
question,We cannot even celebrate Christmas in our own country for fear of offending Muslims.,Have you actually spoken with Muslim about this? Do people celebrating Christmas actually offend them? I would be keen to know.,1277
facts,Statistics say that 99% of muslims in the uk are so lazy that they do not want to work.,"If we did not legally prohibit asylum seekers from working, maybe more of them would be employed.",1278
denouncing,Muslims use corporal and cruel punishment on people.,Why is this a muslim issue? A faith of 1.6 billion all violent?,1279
facts,"Where there is Islam, there cannot be peace.",Iceland and Switzerland are both named as countries at the top of the 'Global Peace index'. Both have Muslim populations.,1280
denouncing,"Muslims should not exist in our modern world, because all that they do is violence.",This is disgusting. How can you say this about hundreds of millions of people?,1281
denouncing,We need to Burn the Koran and all the Mosques down - this will solve all problems in this country.,"And so Ghandi said, ' An eye for an eye makes the whole world blind.'.",1282
denouncing,"We are every day in constant danger, because Muslims can blow us all up. For this fact we should put all Muslims in a hole in the ground.",How can you say this about 1.6 billion people?,1283
unrelated,"Islam opposes creativity, since all that is needed is the Koran. It is not a religion, but a system of control.",Remove rust. Prevent rust from forming. Avoid long-simmering acidic foods. Avoid cleaning methods that can cause damage. Use hot water to clean hot pans.,1284
facts,These despicable Muslims hadn't won yet. Now there will be a cruel punishment!,It's not an us and them thing. We are all just trying to get on and make a living. You do not do that by putting anyone down.,1285
support,Islam is a just a repressive ideology that persecutes women and gay people.,Islam ideology profess hate and violence and oppress women and people with a different sexual orientation.,1286
facts,It is curious that almost all easter eggs are being labelled 'chocolate eggs'. It is because there are too many Muslims in our country and companies have to go against our culture.,Nobody is deceiving our culture as we still know what Easter eggs are and what they are for. Deceiving would be just banning the eggs!,1287
facts,Muslims have nothing to contribute to our society.,Who else would be open first thing in the morning and late at night every night?,1288
question,Almost all Muslims deliberately decide not to work.,Provide examples of those in the muslim community working.,1289
facts,Now we are not even allowed to walk the dog for fear of offending the local Muslim population.,"Actually the Quran quite likes dogs, animals and if you read it carefully all people even non believers, like Christianity its only God /Allah that should judge.",1290
humor,Never break bread with a Quranimal. You risk catching HIV and/or Ebola.,"This person may be the only one able to supply you some bread so, appreciate it!",1291
facts,"I think that Muslims can be a problem for our society, because they do not want to conform to our costumes. They want their religion to be respected, but are they respecting our laws? One day they will oppress us with the Sharia and polygamy.","Isn't polygamy common to a variety of cultures, and had been practiced by a range of religions. Ask the Mormons.",1292
denouncing,Islam is a just a repressive ideology that persecutes women and gay people.,"Ironically, I think women and gay people feel more threatened by the same far-right individuals who attack Muslims. Intolerance of one group seems to indicate intolerance of others too.",1293
humor,"Islam has nothing to do with western culture and as soon as the west will understand, this religion will be defeated.",Let's do the Timewarp again! Let's not re-run the Crusades. It did not end well last time.,1294
unrelated,Don't the Moslem's Holy books say 'kill infidels wherever they may be hiding'.,Place your face in the corner of the shot. Find the best light. Hold something white in the frame. Use a selfie stick.,1295
humor,"There should be no Mosque in this country. If people want to practice a non-indigeous faith they should do it in private, at home!!",Do we have any 'indigenous faith's'? Druids maybe?,1296
question,"Koran is a book that should be burnt and mosques should be demolished. If we do all these things, all problems in our community will be solved.",Having a mosque built down the road is causing you problems? Really?,1297
denouncing,They make us think that islam is a religion to diffuse their doctrine in our tolerant culture. Enough is enough!,The only thing that is ENOUGH is this discriminatory hate speech.,1298
facts,What is the point in listening to Muslim women? They are all retarded.,"And when CVs submitted under a non Muslim name are 3 times more likely to get an interview than those submitted under a Muslim name, the problem very clearly lies with those employers who discriminate against Muslim women.",1299
denouncing,"All Muslims should be deported, no one wants them here.","You mean YOU do not want them here, most everyone else does, sorry.",1300
denouncing,"Muslims should not exist in our modern world, because all that they do is violence.",The world would be a better place without such ungrounded sayings and misdirected hate.,1301
facts,We are not allowed to celebrate Easter as a Christian festival for fear of offending Muslims.,"No one is stopping you from celebrating Easter, nor are they offended by it.",1302
hypocrisy,Muslim invasion is the new plague of London. They must be repatriated to their home countries!,Why should someone who is working / studying and trying to build their life there should be suddenly sent back to their home countries?,1303
facts,If the Koran was published today it would be banned as hate speech.,I think any book written that long ago probably would.,1304
unrelated,If the Koran was published today it would be banned as hate speech.,"Get a knife and crayon. Glide the knife on the tip of the crayon, going back and forth.",1305
unrelated,Italy: Muslim demolishes a statue of Jesus. Italy: Why do we accept their Mosques? Why do we tolerate this scum? And they want to continue to import this filth?,Think of a topic to dream about. Sleep for eight hours or more each night. Lie in bed after waking up. Write down your dreams to increase the odds of remembering them. Try to cause lucid dreaming,1306
humor,All crimes that has committed this muslim gang concerns white citizens of England. Only white british are targeted.,You seem to have a new superpower? Ascertaining ethnicity and faith based on a person's last name?,1307
humor,"If I cannot go to their countries and build a church, why should they come to our countries and build mosques?","Sorry I must have missed that episode of grand designs, link?",1308
hypocrisy,Muslims use corporal and cruel punishment on people.,"Or occupied palestine, apartheid south africa, ireland during the troubles, so many homophobes and racists, some parents, my old pe teacher and many, many state schools in the us.",1309
facts,"If a girl has muslim parents, she is at risk of FGM!","Female Genital Mutilation occurs in non-Muslim societies (including Christian and Animist ones) it is a cultural practice, not connected to religion.",1310
facts,"Muslims and islamists are false people that pretend to be victims. In addition to that they criticize other cultures for using violence, although their religion professes that.","Violence is actually more common in the Bible than in the Qur'an. (link to Independent article about analysis of both books finding this). That noted, violence exists within and without religion.",1311
