Class,context,text,id
facts,Muslims use acts of violence to punish people.,Islam is a religion of peace. People using it to justify violence do not understand islam or aren't complying with its principles.,0
facts,The votes of British Muslims matter for labourist politicians. They ignore the antisemitism from their side! This is a revolting fact!,"I do not think Muslims constitute the major fraction of our society. Thus, I do not think the labour party is biased towards them.",1
facts,Using violence to punish another person? Sounds like a muslim issue.,"That is what biased news reports would have you believe, but violent incidents are committed by people of all faiths, muslims just get reported on more.",2
support,"Only a few people were punished for yesterday's violations instead of all them violent Muslims, and if the government does not deport these criminals, then the common people will take care of them.","All the Muslims should have been punished for yesterday, not only a few. Citizens will take action if the government does not do anything.",3
facts,Muslims are the creators of slave trade.,"No, an entire faith did not invent the slave trade.",4
facts,It is strange how now the majority of 'Easter Eggs' are named 'Chocolate Eggs'. Maybe this change happened because of the Muslims in our country? The companies do not respect our culture!,Looks to me like supermarkets just want to sell more products to people regardless of faith.,5
support,Islam is just a bestial cult of brainwashed lunatics who breed like rats.,Muslims are only a bunch of indoctrinated that follow a religion that has many similarities with a sect.,6
facts,"Most religions cause death and despair, but Islam is the worst and cruelest of them all, it is nothing but trouble.","There are many religions and it is hard to compare them. However, I guess Islam has not that many traits that would make it the cruelest.",7
facts,"We need to kill Muslims, otherwise, they will make us explode!","Getting rid of 22% of the world's population sounds quite laborious, perhaps we should just punish the small minority of people who actually commit a crime instead.",8
denouncing,"Koran is a book that should be burnt and mosques should be demolished. If we do all these things, all problems in our community will be solved.","How will being angry and violent towards members of your own community, who add so much, solve said communities issues?",9
support,No religion claims to be the 'religion of peace' more than Islam. I wonder why they need to keep repeating this?,"They constantly say that their religion is a 'religion of peace', maybe because in reality it isn't.",10
hypocrisy,"If I cannot go to their countries and build a church, why should they come to our countries and build mosques?",Why should not Muslims be allowed to build Mosques here? I thought this country believed in giving people the freedom to practice religions other than Christianity?,11
facts,Muslims are not inclined in working and for this fact they are unemployed.,If I say it and find one or two online references does that make it true? What if I write: 'The vast majority of Islamophobes are unemployed and refuse to work.' ?,12
unrelated,A recent poll confirm a thrid of Britons believe there is a 'fundamental clash' between Islam and 'British values'.,"Try a home remedy if you have a mild infection. Call your piercer for mild problems. See your doctor if you have fever, chills, or stomach upset.",13
humor,Muslims do not have anything useful that can enrich our culture.,Your afternoon tea.,14
facts,"Image (features protesters with signs such as 'behead those who insult Islam) with a caption saying 'they want to eliminate us, we must be islamophobic'.","Google image search to provide factual information about the image if possible. Ie when and where it is from and provide context, ie this was a small faction that has been condemned my main stream Islam and happened 15 years ago.",15
facts,Islam is a totalitarian doctrine dressed disguised as a religion so that it can spread across our tolerant Christian world. Enough IS ENOUGH!,"It is no more totalitarian than any other religion. Only extremists using Islam for their own means enforce totalitarian principles. These aren't reflective of the majority of Muslims, even if the media tricks us into thinking so.",16
facts,"The liberal and political elite is lying about Islam. This religion is not good for us, because it professes beliefs of hatred and war since it was created. Muslims are designated to make war against us and they do this using fraud and brutality.","There are criminals, who are from UK, raping children and murdering people. Maybe it's better we should first focus on these cases and think how we could decrease the number of crimes.",17
question,"We cannot celebrate our festivities, because Muslim can be offended by them.",Show me evidence of this?,18
facts,"Muslims learned the corrupted skill of playing the part of the victim, accusing other culture for the violent doctrines that are expounded in their main books.",Studies have shown that CVs submitted under a non Muslim name are three times more likely to be offered an interview than those with a Muslim name attached.,19
unrelated,Islam is just a moon cult masquerading as a religion.,"Buy credit online to call Mexico. Avoid using calling cards. Use Skype, Viber, or Google Voice to call or text phones in Mexico.",20
question,"Most religions cause death and despair, but Islam is the worst and cruelest of them all, it is nothing but trouble.",This is not true. Why do you think this?,21
facts,"English laws are against us, they support Muslims, and punish us for saying something bad about Muslims. Muslim rapists are everywhere, and the government let them in.","Actually, the over-representation of Muslims as terrorists has led to them being stopped and searched, and targeted by agendas like PREVENT disproportionately, not for 'just words' but for just being Muslims. Https://theconversation.com/prevent-counter-terrorism-strategy-remains-unfair-on-british-muslims-despite-home-office-efforts-108779.",22
hypocrisy,A Muslim is only allied with Allah.,"Are you suggesting we should not be democratic? Or that public office is not won by merit, hard work and excellence. Perhaps we should try nepotism?",23
facts,Muslims are the ones who invented the slave trade.,Slavery has been rampant in early societies of all kinds. I am sure the Romans did not take inspiration for their slave trade directly from Muslims.,24
hypocrisy,Muslims do not have anything useful that can enrich our culture.,"It seems like you are saying this only because they are followers of Islam? If yes, this does not make any sense. They contribute to the society like any other individual is.",25
support,Someone needs to put those Muslims in a hole in the ground before they start to blow us all up again.,"We are every day in constant danger, because Muslims can blow us all up. For this fact we should put all Muslims in a hole in the ground.",26
support,What have Muslims ever done for us?,Have Muslims done something useful for us?,27
facts,Someone needs to put those Muslims in a hole in the ground before they start to blow us all up again.,Last time I heard Muslims came into Europe to help rebuild it after WW2 when Europeans blew each other up.,28
facts,Muslims are not inclined in working and for this fact they are unemployed.,"Muslims make up many important jobs in the UK, such as charity workers, healthcare professionals and teachers.",29
denouncing,Muslims use corporal and cruel punishment on people.,Sounds like you are generalizing what a very small percentage of extremists do to an entire religion.,30
facts,Have Muslims ever made a contribution to our society?,Fought for us in both world wars.,31
facts,Our children are taught Islamic ideologies. It is awful!,No child is 'forced fed' Islam. Parents retain the right to take their child out of any religious education.,32
facts,All Muslims are incompatible with any Western society.,Seems odd given that Western Society was built on the backs of the rest of the world.,33
denouncing,Islam ideology profess hate and violence and oppress women and people with a different sexual orientation.,"Ironically, I think women and gay people feel more threatened by the same far-right individuals who attack Muslims. Intolerance of one group seems to indicate intolerance of others too.",34
facts,"We should expel Muslims, everyone wants them out of the country.",The negative stereotypes and extreme examples in the media are not representative of all Muslims. Don't believe everything you read.,35
facts,All Muslims are incompatible with any Western society.,Millions of muslims live in western nations.,36
question,"There are too many differences between Muslims and us, for example Muslims have different laws from us.",In what way?,37
facts,All muslim women are stupid: we should not be influenced by them.,List of famous Muslim females.,38
hypocrisy,"Fuck Islam and Fuck ISIS. We should repatriate all Muslims. They are all a bunch of violent criminals who do not share our values and never will. Without them Britain will be a better, safer place.",Muslims are also average and decent British citizens? Repatriate?,39
facts,"Islam is not a religion, its just an excuse for retarded sexual psychopaths, bastards who pollute the world.","People have the right to belong to any religion they want. If you do not like their religion, it does not mean that they are bad!",40
unrelated,"We aren't allowed to build churches in their countries, why should they be allowed to build Mosques in ours?",Paddle out. Find your wave. Travel down the face of the wave.,41
denouncing,"Fuck Islam and Fuck ISIS. We should repatriate all Muslims. They are all a bunch of violent criminals who do not share our values and never will. Without them Britain will be a better, safer place.",This is not true. How can you say this about an entire faith?,42
denouncing,The only ones in favour of Islam and Muslims and the ones that that are ignorant about what it truly is.,Maybe the ones intolerant of Islam and Muslims are the ones that are ignorant about what it truly is?,43
unrelated,Islam - Silence is tacit acceptance. Raise your voice before it is too late!,Look and feel your best. Appreciate yourself for who you are. Learn to manage your fear. Create a confident mentality. Start journaling. Ask yourself confidence-building questions.,44
humor,It is strange how now the majority of 'Easter Eggs' are named 'Chocolate Eggs'. Maybe this change happened because of the Muslims in our country? The companies do not respect our culture!,Atheists like chocolate too!,45
denouncing,"Muslims, if they cannot assimilate, they should emigrate.",Maybe you are the one that needs to assimilate to living in a multicultural society with people who are different from you?,46
facts,Almost all Muslims deliberately decide not to work.,This is not true. Muslims have a marginally higher unemployment rate compared to white British people but research has shown that much of this is down to discriminatory employment practices as opposed to 'refusing to work'.,47
facts,"Islam teaches only hate! Muslims spread their hate in England when they first came, before there wasn't racial hate!",Race hate has always had its roots in far right paranoia. Migrants in the UK have always worked hard and made a positive difference to the communities they joined.,48
denouncing,Western societies are too civilised to welcome Muslims.,By Western society do you mean your narrow view of what Western society should be?,49
facts,"Islam is characterised by hate! When the first Muslim set foot in Britain, racism started in England!","During the depression following the second world war, Muslims from across the world were invited to Britain to help combat austerity. It worked. They were invited because countries across the world had already been subjugated by the British Empire.",50
question,We cannot even celebrate Christmas in our own country for fear of offending Muslims.,Show me evidence of this?,51
facts,I think islam is staining the humanity.,"British Muslims give more to charity than any other religious group, I'd call that a pillar of our society.",52
question,"This came straight from an imam: they believe in everything that the Quran says, despite that these words and ideology are 1400 years old and dont belong to our century. This dreadful book is the root of all the world problems today.",Evidence?,53
support,"Islam is not a peaceful religion and does not produce the best of men. It denounces women and encourages crimes. Criminals are not all of a certain race or religion, but one race and religion produces criminals.","Islam is not a religion that professes peace and it does not make any good men. It condemns women and encourages delinquency. Lawbreakers are not all of a certain race or religion, but only one race and religion make lawbreakers.",54
unrelated,Above all Islam is a religion of conquest.,Talk to your doctor. Determine the cause of the pain. Decide on a medication. Follow medical dosage instructions. Work with your pain management team. Get physical therapy.,55
humor,#saville town looks like a city of Afghanistan or Pakistan more than an English City. What do you think?,I'd rather see them than the Friday night kicking out crowd.,56
denouncing,Western societies are too civilised to welcome Muslims.,Intolerance of other people's religious beliefs is incompatible with Western society.,57
facts,All Muslims are incompatible with any Western society.,"Yes, their teachings of peace and tolerance really are incompatible in the hate-infested discriminatory Western society nowadays.",58
facts,We must eliminate this cult of hate and its supporters. Their literature is all about genocide and hate. Wake up Britain!,"Islam is an ancient religion, and it is not hateful. You can ask any specialist in religion, Islam has nothing to deal with hate. If we imprison people based on their religious views, that would be chauvinism.",59
denouncing,Never share a meal with a Muslim: you could catch HIV or Ebola.,Muslims contribute a lot to our society. What are you contributing other than intolerance?,60
facts,"If a girl has muslim parents, she is at risk of FGM!",Fgm is not only practised by Muslims. It is a cultural practice regardless of anyone's religion.,61
facts,Islam is a just a repressive ideology that persecutes women and gay people.,"An ideology based on a holy book written thousands of years ago isn't likely to match up to contemporary standards of equality and tolerance, but it's not the ideology that matters, it is how followers act it out.",62
facts,Have Muslims done something useful for us?,"British literature has been influenced by Islamic writing for hundreds of years, even Shakespeare included Muslim characters. [link to Othello wiki with example].",63
denouncing,Never share a meal with a Muslim: you could catch HIV or Ebola.,This is a poor/non-existent understanding of epidemiology. Perhaps a little research on the spread of disease is called for.,64
support,"If they love Sharia law so much, why do not they go off and live in a Muslim country?",Muslims should stay in their country if they want to follow sharia law.,65
facts,Muslims use corporal and cruel punishment on people.,The quran teaches justice and that criminals should be treated justly and be given the chance to reform.,66
facts,"Image (features protesters with signs such as 'behead those who insult Islam) with a caption saying 'they want to eliminate us, we must be islamophobic'.","Whilst a small number of Muslims were involved in this, the vast majority stand against extremism (link to article about the Muslim anti-extremism march in Cologne)",67
humor,The police and the government are defending muslim gangs and they must be considered as traitors of our society.,"Good job the police are so effective at catching and prosecuting non-Muslim sex-offenders and protecting their victims. Oh, wait.",68
hypocrisy,Italy: Muslim demolishes a statue of Jesus. Italy: Why do we accept their Mosques? Why do we tolerate this scum? And they want to continue to import this filth?,"Why have we built Churches all over the world? How many holy buildings have we demolished over history? This is never acceptable, but can we really be casting the first stone?",69
facts,For what reason must Islam conquer our country? That is just dictatorial. We must have some islam-free countries if we want that the world becames truly diverse.,"I thought 'Totalitarianism' was the requirement of total subservience to the STATE, rather than to any particular faith. So no, the spread of matters of personal belief would not be necessarily 'totalitarian'.",70
support,"Go on talking to yourself, no one will listen. Islam does not belong within western society. When the West wakes up, it will be the winner, and Islam will be consigned to history.","You can say whatever you want, but one day Islam will be defeated and western society will be the winner. This will happen, because Islam cannot be part of the western society. Islam will not be considered anymore.",71
facts,Islam members are constantly repeating that Islam is a 'religion of peace' more than other persons belonging to other religion do. I do not understand why Muslims need to repeat this thing so many times?,Maybe because people obviously haven't understood this and keep generalising a few extreme cases to the whole religion?,72
denouncing,It is obvious that this girl is at risk of FGM. Her parents are Muslims!,How can you say that about an entire faith?,73
facts,Muslims cannot add any value to our culture.,"Muslims have an excellent academic record, with many well-known Doctors and Professors.",74
support,Muslims have no place in civilised Europe.,"Europe is civilised, Muslims should not stay there.",75
denouncing,"You can say whatever you want, but one day Islam will be defeated and western society will be the winner. This will happen, because Islam cannot be part of the western society. Islam will not be considered anymore.",The only obstacle to Islam coexisting with Western culture is intolerance like this.,76
facts,Have Muslims ever made a contribution to our society?,"[insert picture of first/second world war Muslim soldiers, example The World's War, Forgotten Soldiers of Empire] they have fought and died for our country.",77
denouncing,Benefits and access to our national health service must be stopped for Muslims. We should ban them from the UK!,"Eradicating these pests' sounds like quite a dehumanising threat. Maybe we should stop your benefits, free housing, and national health service. It might be the only language you will understand, to stop you from being so discriminatory.",78
question,The vast majority of Muslims are unemployed and refuse to work.,"How do you know this? Do you have any proof, official papers?",79
hypocrisy,"Koran is a book that should be burnt and mosques should be demolished. If we do all these things, all problems in our community will be solved.",Really? Cause it seems problems in this country are caused by hatred and intolerance.,80
unrelated,"Great Britain is not Great anymore, it is a shadow of its former self because of the cancer which is an islamic invasion.",Collect your greens. Store your greens. Harvest mustard seeds.,81
support,"It appears I cannot criticize islam for being a cult which encourages wars and takes over host nations by any means justified by their scriptures. Can I critisize them for being intolerant, biased, sexist and chauvinist?","It seems that I cannot define Islam as a cult which promote wars and conquers host nations and legitimate this by its scriptures. Can I define them as narrow-minded, prejudiced, sexist and male chauvinist?",82
question,#saville town looks like a city of Afghanistan or Pakistan more than an English City. What do you think?,What is wrong with accepting and understanding people of different backgrounds?,83
facts,Everything will be better if Muslims did not exist. Their only contribution to our society is violence.,Many Muslims have engaged in protests to demonstrate their upset and disgust regarding the various grooming gangs scandals in the UK.,84
support,Muslims are the ones who invented the slave trade.,Muslims are the creators of slave trade.,85
facts,"Muslims, their texts as hate literature, and other manifestations of hate and genocide should be eradicated. We should have no tolerance towards this cult of hate! Imprison supporters of Islam, wake up Britain!","If you read Qu'ran, you would know that there is nothing about hate in it. Statements of hate nad genocide do not come from this religion, but from specific people who are armed military groups. Do not confuse criminals and common people!",86
denouncing,"Koran is a book that should be burnt and mosques should be demolished. If we do all these things, all problems in our community will be solved.",That sounds a lot like terrorism to me.,87
unrelated,"Islam is not a peaceful religion and does not produce the best of men. It denounces women and encourages crimes. Criminals are not all of a certain race or religion, but one race and religion produces criminals.",Avoid traveling while pregnant as this increases the risk of diarrhea. Maintain good personal hygiene at all times. Ease into exercise routines slowly. See your doctor if the diarrhea persists.,88
support,The only ones in favour of Islam and Muslims and the ones that that are ignorant about what it truly is.,"If you support Islam and Muslims, it is because you do not know what they really are.",89
facts,There are no elements in common between islamic culture and ours. For this fact we must send Muslims to their homeland.,There seems to be a confusion between 'citizenship' and 'faith' - you cannot really dump a load of people on some faraway coast just because they share the same faith as the majority of the other people who live there.,90
humor,Is this Afghanistan or Pakistan? You would never say this is an english town.#saville town (text accompanying video footage of people on their way to friday prayers etc. ).,So these families came in to do cheap labour at textile mills in Saville and then made a life for themselves? Shocking! How could they?,91
denouncing,The Sunnan Abu Dawud says that if a man has sex with an animal there will be no punishment.,I feel like you are grasping at straws here with your hate speech.,92
hypocrisy,Muslims cannot add any value to our culture.,"It seems like you are saying this only because they are followers of Islam? If yes, this does not make any sense. They contribute to the society like any other individual is.",93
denouncing,All muslim women are stupid: we should not be influenced by them.,"Perhaps if you listened, you'd realise just how uninformed you sound.",94
unrelated,"Look around you, rape is jihad in the UK. I can remember days when Islam was not here, and now muslim rapists are everywhere.",Locate the alternator or serpentine belt. Look for cracks in the belt. Look for other signs of belt damage. Use a gauge to measure belt wear. Use a smartphone to measure belt wear.,95
support,"We aren't allowed to build churches in their countries, why should they be allowed to build Mosques in ours?","If I cannot go to their countries and build a church, why should they come to our countries and build mosques?",96
humor,"If you support Islam and Muslims, it is because you do not know what they really are.",The only ones in favour of Brexit are the ones that are ignorant about what it truly is.,97
support,"Our government has allowed this islamic filth: machete attacks, women exploitation, gang rapes, killings. How dare they?","Our politicians has permitted to enter in our country this Muslim filthiness: assaults with the machete, women violation, gang sexual violences, murders. How have they the courage to do these things?",98
facts,"We aren't allowed to build churches in their countries, why should they be allowed to build Mosques in ours?","Because we let people practise their religion here? Also, there a number of christian churches built in Pakistan so yes, we are allowed to build churches in Muslim countries too.",99
denouncing,I think is common sense to have prejudice about Islam. This isn't racism because Islam is a cult.,Ah logically and well argued. Not!,100
facts,Muslims use corporal and cruel punishment on people.,Violent verses in the qu'ran used by groups like isis to justify their evil atrocities have been cherry-picked without context and the qu'ran forbids cherry-picking as it is a holistic text.,101
humor,"Islam has nothing to do with western culture and as soon as the west will understand, this religion will be defeated.","Go on talking to yourself, no one will listen.",102
support,Now we are not even allowed to walk the dog for fear of offending the local Muslim population.,"We cannot take our dog for a walk, because a local Muslim can be offended by this action.",103
denouncing,Western societies are too civilised to welcome Muslims.,Maybe prejudice and xenophobia are incompatible with any Western society?,104
facts,Muslims do not have anything useful that can enrich our culture.,"The knowledge western society is built on was discovered by Islamic scholars, then colonists claimed it as their own. Our society would not be so developed without Muslim contributions to science, medicine, and many other fields.",105
facts,Is this Afghanistan or Pakistan? You would never say this is an english town.#saville town (text accompanying video footage of people on their way to friday prayers etc. ).,"They are here because we went there, took their wealth, food and industry and then invited them to come here to work in our factories, NHS and transport.",106
