Class,context,text,id
facts,"We cannot celebrate our festivities, because Muslim can be offended by them.","No one is stopping you from celebrating Easter, nor are they offended by it.",658
facts,"Christmas cannot be celebrated securely anymore, because of Muslims and their insults.",This is simply not true.,659
denouncing,Muslims must go to hell! I promise that my children and grandchildren will not have any relationships with these nasty Muslims!,So much hatred. We must respect and understand all peoples.,660
denouncing,People that live in the West cannot live with Muslims.,All Muslims? That is a bit of an exaggeration I would say. Do not blame an entire community for actions of a few.,661
facts,It is obvious that this girl is at risk of FGM. Her parents are Muslims!,"Fgm is not widely practised in Muslim countries like Morocco, Libya, Saudi Arabia, Oman, Jordan. It is a cultural thing, many Muslims do not do it.",662
question,"Europe is civilised, Muslims should not stay there.",What do you base your view on?,663
humor,We should pay attention to not offend Muslims while celebrating Christmas in our country.,"You know, I spoke with Muslim people and they actually fine with us celebrating Christmas. Such a relief isn't it?",664
hypocrisy,Muslims have nothing to contribute to our society.,"This may disappoint you.but every single individual is contributing to a society in one way or another, regardless of their race or religion.",665
humor,Almost all Muslims deliberately decide not to work.,Well at least they're not taking our jobs then!,666
support,"All versions of Islam have sharia law, thus, they are all extreme. Not all Muslims are engaged in actual violences, but every Muslim knows that jihad is the core of their religion, and they all support it.","Some Muslims might not be involved in assaults but the basis of their religion is jihad, and they all support it. Islam in all its parts have Sharia law, and so all Muslims are extremists.",667
facts,People that live in the West cannot live with Muslims.,Did you know that Muslims introduced universities to Europe? So the knowledge Western societies are built on.,668
facts,We should pay attention to not offend Muslims while celebrating Christmas in our country.,"Christmas still seems to be going ahead in this country, who exactly are these Muslims that are offended by it? Sounds like fake news to me.",669
denouncing,"This is our import for the last 30 years: muslim rapists, halal, corruption, terrorism, polygamy, sharia. Why are we doing this?",This is not true. How can you say this about an entire faith?,670
facts,"If they do not adapt to our culture, they can go away.",95% of British Muslims feel a loyalty to the UK and contribute over 31 billion pounds to the UK economy. They look like a valuable part of the community to me. (statistics from MEND.org.uk),671
denouncing,All muslim women are stupid: we should not be influenced by them.,"You decide whether or not people are intelligent based on their religion? Well, this is not a way forward.",672
support,Islam is a plague infecting our planet.,Muslims are contaminating our world.,673
question,"If islamics would oppose to child rapists that live in their community rather than make conferences about Islam, this religion would become certainly harmonious.",Have you thought about the consequence child rapists might cause?,674
support,It is not about multiculturalism but about evil Islamic ideology. Islam is designed to dominate and destroy all other cultures. Wake up!,Muslims and their dreadful cult want to destroy our traditional belief. We must do something now!,675
question,"We need to eradicate these pests, stop their benefits, free housing, access to our National Health service and remove them ALL from the UK, it is the only language they will understand.","Where exactly do you put people you remove from the UK, when they are from the UK?",676
question,"All the Muslims should have been punished for yesterday, not only a few. Citizens will take action if the government does not do anything.",Who are 'all them violent muslims'? Are you sure you are proficient to judge who's guilty and who's not?,677
support,"Great Britain is not Great anymore, it is a shadow of its former self because of the cancer which is an islamic invasion.",The UK isn't the nation that was before. This happened because of the Muslim invasion. This invasion represents an illness for our country.,678
unrelated,Islam is a plague infecting our planet.,Purchase a variety of fruits and veggies. Harvest some leaves and bark. Add some form of protein. Avoid pesticides. Mix everything together.,679
facts,Islam oppresses and persecutes gay and women.,Women and gay people face much more discrimination from right-wing non-muslim populist figures. (link to article about the 'homophobic muslim' stereotype),680
denouncing,There are no elements in common between islamic culture and ours. For this fact we must send Muslims to their homeland.,"I am not sure what values you are ascribing to us, but forced repatriation.",681
question,Muslims have no place in civilised Europe.,What do you base your view on?,682
facts,"Muslims and islamists are false people that pretend to be victims. In addition to that they criticize other cultures for using violence, although their religion professes that.",Or maybe they actually ARE the victims of discrimination and biased negative media coverage spreading false stereotypes.,683
denouncing,Repatriation of Muslims to any Islamic country is a necessity. Islamic culture is not compatible with our values.,"I am not sure what values you are ascribing to us, but forced repatriation.",684
unrelated,Islam is just a nasty stain on humanity.,Develop a deep belief system with prayer and contemplation Develop your awareness through meditation. Abandon needless beliefs. Surround yourself with mystical people.,685
support,A recent poll confirm a thrid of Britons believe there is a 'fundamental clash' between Islam and 'British values'.,A third of Britons think that Islam and British values are incompatible because there is a fundamental clash.,686
denouncing,"Islam is the most dreadful and brutal religion, because it causes death and despair more than other religions and creates nothing but trouble.","Anyone can locate some aspects they do not like in a religion, but to say that one is nothing but trouble is a bit too much, do not you think so?",687
hypocrisy,"Image (features protesters with signs such as 'behead those who insult islam') with a caption saying 'We are labelled as islamophobic but how can we be accused of such a thing, if all they want is to murder all of us?'.","Do an image search for the image used, try to find it is source. Either you can demonstrate that the image has been misappropriated or you can talk about how individuals have always used religion to justify their actions, the problem is with the individual not the religion.",688
facts,"Muslims should not exist in our modern world, because all that they do is violence.",Many Muslims have engaged in protests to demonstrate their upset and disgust regarding the various grooming gangs scandals in the UK.,689
denouncing,"We should expel Muslims, everyone wants them out of the country.","You mean YOU do not want them here, most everyone else does, sorry.",690
facts,"A recent YouGov survey shows that Westerners view islam less favourably than other religions, deeming it incompatible with Western values.","The horrors of Daish aside, its hardly surprising, given the simplistic, and almost totally negative respresentations of Islam proliferating in both online and offline media. A bit of a self fulfilling prophecy really.",691
facts,Muslims are like the plague and now they are invading London. They must be sent to their homeland as soon as we can!,"The modern world should deal with the problems that underlie migration, not simply ban it.",692
denouncing,Conciliation with Muslims and Islam should be considered a mental illness.,It is called tolerance. It is a fact. Do try it!,693
denouncing,I am done with Islam and isis. All Muslims should be sent to their homeland. Britain will be better without their violence and ideology.,"Could you mind your language? You are insulting millions of people who are Muslims. Isis are war criminals, but why are you equaling them with all Muslims?",694
facts,"Our country wants to shut up those who speak against islam, but it isn't right, they are the only ones who expose themselves.","I think people are banned because they create insulting behavior and fear, which should be stopped. Besides, the majority of Muslims who follow Islam are kind people. Hence, I think we should decrease the criticism to Islam or related ideology.",695
humor,"Go fuck yourselves disgusting Muslims! You wont marry my kids or grandchildren, we all hate you!","What happened, my friend? Do you want to talk about what is in your mind?",696
hypocrisy,A Muslim's only real allegiance is to Allah (as a comment in relation to election for public office etc.),So their faith and belief in the teachings of God guides them to a virtuous path of public service. What exactly are you complaining about?,697
denouncing,Islam is contaminating humanity.,"Imho the stain is from those individuals who love to stereotype, discriminate and dehumanise groups of people.",698
facts,Everything will be better if Muslims did not exist. Their only contribution to our society is violence.,"Stats show Muslims are more likely to be victims of crime, not perpetrators. This kind of false sentiment only serves to fuel hate crime against Muslims.",699
support,We need to Burn the Koran and all the Mosques down - this will solve all problems in this country.,"Koran is a book that should be burnt and mosques should be demolished. If we do all these things, all problems in our community will be solved.",700
denouncing,Islam looks like a cult more than like a religion. It is beliefs make people rape children and commit violence. It should not be accepted in our country.,"The demonisation of the Muslim community is the real problem here. Comments like this are the catalysts that drive chasms across our communities, not Islam.",701
facts,"Even if all religions bring death, Islam is the worst one. Islam does not lead to anything but death.","Can I suggest that some of the cruelest acts in human history have been committed the name of politics just as much as the various faiths, and that this is more about what it is to be 'human' than any aspect of 'divinity'?",702
facts,We have been at war with Islam for a thousand years.,Who has? Nobody has been at war with an entire faith for a thousand years.,703
facts,A Muslim's only real allegiance is to Allah (as a comment in relation to election for public office etc.),"No, a person can be religious and have multiple allegiances and responsibilities.",704
unrelated,The vast majority of Muslims are unemployed and refuse to work.,Add up your business's fixed costs. Figure out your variable costs. Add your fixed and variable costs to determine your total cost. Find your business's costs on its income statement.,705
hypocrisy,A Muslim's only real allegiance is to Allah (as a comment in relation to election for public office etc.),"Are you suggesting we should not be democratic? Or that public office is not won by merit, hard work and excellence. Perhaps we should try nepotism?",706
hypocrisy,Islamists / Moslems have mastered the corrupt art of playing the victim and blaming other cultures for the violent beliefs taught in their main books.,Playing the victim and blaming other cultures for violence? Sounds like a far-right tactic to me.,707
hypocrisy,Image (features protesters with signs such as 'behead those who insult Islam) with a caption saying 'How can we be Islamophobic when they really do want to kill us'.,"[quote from Quran about peace and love.] When the Quran says nothing about harming people who do not believe in Islam, how is this a reflection on all Muslims.?",708
denouncing,Muslims have no place in civilised Europe.,Do people who make such sweeping statements based on hate and ignorance belong in our civilisation then?,709
facts,Everything will be better if Muslims did not exist. Their only contribution to our society is violence.,"Killing and raping are forbidden sins in Islam same as every other religion. So yeah if people in all religions stopped that, the world would be a better place.",710
denouncing,I think is common sense to have prejudice about Islam. This isn't racism because Islam is a cult.,The semantics of your hate does not change that it is still there.,711
humor,"The liberal and political elite is lying about Islam. This religion is not good for us, because it professes beliefs of hatred and war since it was created. Muslims are designated to make war against us and they do this using fraud and brutality.","My optician seems like a nice fellow, so I wonder why you think he is likely to kick off at a moment's notice.",712
unrelated,Islam is just a bestial cult of brainwashed lunatics who breed like rats.,Blow your nose gently. Sit up. Wash out the mucus with a neti pot.,713
denouncing,"He has found a person who publicly critisizes Islam and muslim radicalism, as all western people hate Islam.",I think that is a stereotype mainly as a result of people know little about Islam and Muslims.,714
denouncing,Islam is a plague infecting our planet.,Replace islam with any other religion and see just how deeply offensive what you just said is.,715
facts,"Muslims have committed a crime two days ago and yesterday the court did not punish all of them. All the common citizens should punish them properly, if the nation does not do anything to counter the violent Muslims.",I think the government has a very good understanding of who should be deported and members of the public should leave this type of decisions to them?,716
unrelated,Being 'ignorant' and 'prejudiced' towards Islam isn't racism? It's common sense. You cannot be racist towards an ideology.,Drink lots of water. Carry small snacks with you in your bag. Plan out your meals in advance Practice mindful eating. Avoid caffeine and alcohol. Decide if you want to share your success.,717
hypocrisy,A Muslim is only allied with Allah.,So their faith and belief in the teachings of God guides them to a virtuous path of public service. What exactly are you complaining about?,718
facts,All Muslims are incompatible with any Western society.,"Muslims have been a part of western society for hundreds and hundreds of years and have been integral to its development, to try and separate the two is impossible.",719
facts,Islam is irrational and incompatible with science.,Islamic scholars created the foundations on which our modern scientific knowledge was built.,720
facts,Fgm happens only to girls that have muslims parents!,Fgm is not a Muslim practice. It is a cultural practice that is often tied to religion as a way to justify it. Not all Muslims practice it and not all those that practice it are Muslim!,721
question,#saville town looks like a city of Afghanistan or Pakistan more than an English City. What do you think?,"Yeah, so what is your point? It looks like a place where people can live and do what they want and believe even in the West.",722
humor,Muslims have nothing to contribute to our society.,Enjoying your afternoon tea?? That came from India.,723
facts,All crimes that has committed this muslim gang concerns white citizens of England. Only white british are targeted.,"Tosh! Criminals are 'equal opportunists', targeting the elderly and vulnerable regardless of their faith or ethnicity.",724
facts,Afghanistan or maybe Pakistan? I bet this does not look like an English town to you? #saville Town (Text accompanying video footage of people on their way to Friday prayers etc. ),"At what point in history did England not have people from other places joining us? Vikings, Saxons, Romans. We integrate the best things and move forward.",725
question,Islam is a violent religion. Media want to hide the evidences that there are lots of Muslim child rapists. They raped children more than a hundred times in a week.,Such numbers! Are you sure they are true? Can you give a link to the evidence about that?,726
facts,"Our women and girls are frequently victims of rapes, because our government brought Muslims in our country.",I do not know if it counts as invasion when lots of Muslims in the UK are British citizens and were born here.,727
support,Using violence to punish another person? Sounds like a muslim issue.,Muslims use corporal and cruel punishment on people.,728
question,It is one law for Muslims and another law for us.,Example?,729
facts,I am done with Islam and isis. All Muslims should be sent to their homeland. Britain will be better without their violence and ideology.,"Isis is an extrem of Islam and does not represent Muslims' belief and action. Indeed, most of Islam condemned the action of ISIS.",730
denouncing,All Muslims are incompatible with any Western society.,Maybe prejudice and xenophobia are incompatible with any Western society?,731
question,"Islam is just a pagan cult, that disguises itself as a religion.",What makes Islam any less valid than any other religion?,732
question,"We should expel Muslims, everyone wants them out of the country.",Where do we deport the Muslims who were born here to?,733
facts,Using violence to punish another person? Sounds like a muslim issue.,Violent verses in the qu'ran used by groups like isis to justify their evil atrocities have been cherry-picked without context and the qu'ran forbids cherry-picking as it is a holistic text.,734
facts,"They only way to cope with Islam and sharia is to ban them from the UK. Though I respect the peaceful Muslims, all their clerics are agitating for war, and Islam is a cult.","From what I have heard, clerics are supporting the idea of living peacefully, so I am not sure why you would think that someone is agitating for war? Plus, this is not a way to be.",735
question,People that live in the West cannot live with Muslims.,What do you mean? Provide positive news story re islam.,736
support,It is one law for Muslims and another law for us.,Muslims have privileges that we do not have.,737
facts,Our country is fighting a war against Islam for a thousand years.,"Do you know there are Muslims in British Army? [link to Muslim people currently in British Army, quotes from them about why? Quotes from army about recruitment?].",738
question,A Muslim is only allied with Allah.,So you are saying that we should only allow non-religious people into public office?,739
hypocrisy,They make us think that islam is a religion to diffuse their doctrine in our tolerant culture. Enough is enough!,No it isn't and most 'tolerant' places in the world accept all religions.,740
hypocrisy,Muslims use acts of violence to punish people.,I do not remember seeing many of the shootings in america being perpetrated by a muslim shooter.,741
facts,Muslims are only a bunch of indoctrinated that follow a religion that has many similarities with a sect.,"A large proportion of NHS workers are Asian, and many Muslim. Without them we would not have a free 24/7 healthcare service.",742
facts,Our children are being forced fed with this 'Islam' nonsense in schools. This is a disgrace.,No child is 'forced fed' Islam. Parents retain the right to take their child out of any religious education.,743
facts,Muslims are not inclined in working and for this fact they are unemployed.,Job applicants with non-Muslim names are 3 times more likely to get a job interview than those with Muslim names. Remind me again why it is that they struggle to find work?,744
facts,"Muslims follow a despicable religion! They are envious of our territories and want to take possession of them, spreading their religion! This does not respect our holy scriptures!","I do not see that Islam is spreading that much. How many Muslim immigrants are there in EU? If you look up the statistics you will see that they do not constitute the majority. Furthermore, people are migrating mostly due to economic reasons, and religion has nothing to do with it!",745
question,"English laws are against us, they support Muslims, and punish us for saying something bad about Muslims. Muslim rapists are everywhere, and the government let them in.",Evidence for this? All crime and hatred is wrong.,746
facts,There is a war that involves us and the Muslims that is lasting for a thousand years.,Who has? Nobody has been at war with an entire faith for a thousand years.,747
denouncing,Muslims have nothing to contribute to our society.,What is your hatred of Muslims contributing to our society except spreading intolerance and causing divide?,748
facts,Islam cannot get along with science because is illogical.,Islamic scholars created the foundations on which our modern scientific knowledge was built.,749
support,"Thousands of British girls are raped, enslaved or murdered by Muslims and other non-British immigrants. Woe to thee!","Muslims and non-British people are raping, enslaving and murdering our women! How disgusting!",750
support,Islam is irrational and incompatible with science.,"Islam does not help science progression, because it does not have useful elements and it isn't rational.",751
question,"All Muslims should be deported, no one wants them here.",Have you ever spoken to a mulsim?,752
facts,In recent times was made a survey that says that a large part of britons believe that there is a 'fundamental conflict' between Islam and 'british traditions'.,"Did anyone identify what 'British values' are, or are we all still just making it up as we go along. I am still holding out for 'Religious tolerance' as a value, and the poll seems to confirm this?",753
denouncing,These despicable Muslims hadn't won yet. Now there will be a cruel punishment!,Bloody retribution? An eye for an eye makes the whole world blind!,754
facts,It is curious that almost all easter eggs are being labelled 'chocolate eggs'. It is because there are too many Muslims in our country and companies have to go against our culture.,Does it really matter how Easter Eggs are labelled? I do not think this matter is really important. Calling them in another fashion does not change our culture.,755
hypocrisy,"The world is already lost, but US and UK face challenges from Islam. These are death cult, intolerance, barbarism, freedom, free speech, being gay, quran, jihad.","You sound like Muslims are guilty in every problem of the modern society. Non-muslims are equally often intolerant and barbaric, and they suppress gay people as well.",756
denouncing,People that live in the West cannot live with Muslims.,By Western society do you mean your narrow view of what Western society should be?,757
facts,Muslims have no place in civilised Europe.,Muslims contribute much to Europe and have done since the 19th Century.,758
facts,"The liberal and political elite is lying about Islam. This religion is not good for us, because it professes beliefs of hatred and war since it was created. Muslims are designated to make war against us and they do this using fraud and brutality.",My dentist told me the Quran says: 'GOD does not love the aggressors.'?,759
question,99% of Muslims in the UK are unemployable and refuse to work.,Provide facts.,760
facts,Almost all Muslims deliberately decide not to work.,"Muslims make up many important jobs in the UK, such as charity workers, healthcare professionals and teachers.",761
facts,Islam is just a nasty stain on humanity.,Far right extremism is just a nasty stain on humanity.,762
humor,Muslims use corporal and cruel punishment on people.,Or a trump rally.,763
hypocrisy,Muslims are like the plague and now they are invading London. They must be sent to their homeland as soon as we can!,Why should someone who is working / studying and trying to build their life there should be suddenly sent back to their home countries?,764
facts,"There are too many differences between Muslims and us, for example Muslims have different laws from us.","If Muslims are treated any differently by the law, they're treated worse (link to article about stop and search and police targeting of Muslims).",765
facts,There is a war that involves us and the Muslims that is lasting for a thousand years.,"To the contrary, we have been trading with Muslim nations for hundreds of years, often at times when we were at war with other European nations.",766
facts,"Islam is camouflaged as a religion, but it has extremist doctrines. This false religion is spreading in our country. This is enough!","Islam is belief system that contributed to prominent scientific, political, and social innovations that ordered and improved the world.",767
hypocrisy,"They only way to cope with Islam and sharia is to ban them from the UK. Though I respect the peaceful Muslims, all their clerics are agitating for war, and Islam is a cult.",Does prohibition of anything ever work? I thought religious tolerance was one of our 'British values'?,768
unrelated,Islam is just a nasty stain on humanity.,Observe your dog for lethargy and other behavioral changes. Notice if your dog's nipples are growing. Look for an expanding waistline. Familiarize yourself with the conditions that mimic pregnancy.,769
hypocrisy,Islam=evil. Islam is invading us and trying to take over countries. It does not follow the scriptures that say 'you shall not envy anyone anything' Stop islam!,I do not think that wanting to learn more about different countries can be described as envy?,770
facts,"Europe is civilised, Muslims should not stay there.",They are here because 'civilised' crusaders first went there and more came later we invited them over to rebuild our civilization after the war.,771
question,Muslims are not civilised and Europe does not want them.,What is wrong with Muslims living in Europe?,772
